[
  {
    "index": "club",
    "name": "Club",
    "equipment_category": {
      "index": "weapon",
      "name": "Weapon",
      "url": "/api/2014/equipment-categories/weapon"
    },
    "weapon_category": "Simple",
    "weapon_range": "Melee",
    "category_range": "Simple Melee",
    "cost": {
      "quantity": 1,
      "unit": "sp"
    },
    "damage": {
      "damage_dice": "1d4",
      "damage_type": {
        "index": "bludgeoning",
        "name": "Bludgeoning",
        "url": "/api/2014/damage-types/bludgeoning"
      }
    },
    "range": {
      "normal": 5
    },
    "weight": 2,
    "properties": [
      {
        "index": "light",
        "name": "Light",
        "url": "/api/2014/weapon-properties/light"
      },
      {
        "index": "monk",
        "name": "Monk",
        "url": "/api/2014/weapon-properties/monk"
      }
    ],
    "material": "wood",
    "url": "/api/2014/equipment/club"
  },
  {
    "index": "dagger",
    "name": "Dagger",
    "equipment_category": {
      "index": "weapon",
      "name": "Weapon",
      "url": "/api/2014/equipment-categories/weapon"
    },
    "weapon_category": "Simple",
    "weapon_range": "Melee",
    "category_range": "Simple Melee",
    "cost": {
      "quantity": 2,
      "unit": "gp"
    },
    "damage": {
      "damage_dice": "1d4",
      "damage_type": {
        "index": "piercing",
        "name": "Piercing",
        "url": "/api/2014/damage-types/piercing"
      }
    },
    "range": {
      "normal": 5
    },
    "weight": 1,
    "properties": [
      {
        "index": "finesse",
        "name": "Finesse",
        "url": "/api/2014/weapon-properties/finesse"
      },
      {
        "index": "light",
        "name": "Light",
        "url": "/api/2014/weapon-properties/light"
      },
      {
        "index": "thrown",
        "name": "Thrown",
        "url": "/api/2014/weapon-properties/thrown"
      },
      {
        "index": "monk",
        "name": "Monk",
        "url": "/api/2014/weapon-properties/monk"
      }
    ],
    "throw_range": {
      "normal": 20,
      "long": 60
    },
    "material": "metal",
    "url": "/api/2014/equipment/dagger"
  },
  {
    "index": "greatclub",
    "name": "Greatclub",
    "equipment_category": {
      "index": "weapon",
      "name": "Weapon",
      "url": "/api/2014/equipment-categories/weapon"
    },
    "weapon_category": "Simple",
    "weapon_range": "Melee",
    "category_range": "Simple Melee",
    "cost": {
      "quantity": 2,
      "unit": "sp"
    },
    "damage": {
      "damage_dice": "1d8",
      "damage_type": {
        "index": "bludgeoning",
        "name": "Bludgeoning",
        "url": "/api/2014/damage-types/bludgeoning"
      }
    },
    "range": {
      "normal": 5
    },
    "weight": 10,
    "properties": [
      {
        "index": "two-handed",
        "name": "Two-Handed",
        "url": "/api/2014/weapon-properties/two-handed"
      }
    ],
    "material": "wood",
    "url": "/api/2014/equipment/greatclub"
  },
  {
    "index": "handaxe",
    "name": "Handaxe",
    "equipment_category": {
      "index": "weapon",
      "name": "Weapon",
      "url": "/api/2014/equipment-categories/weapon"
    },
    "weapon_category": "Simple",
    "weapon_range": "Melee",
    "category_range": "Simple Melee",
    "cost": {
      "quantity": 5,
      "unit": "gp"
    },
    "damage": {
      "damage_dice": "1d6",
      "damage_type": {
        "index": "slashing",
        "name": "Slashing",
        "url": "/api/2014/damage-types/slashing"
      }
    },
    "range": {
      "normal": 5
    },
    "weight": 2,
    "properties": [
      {
        "index": "light",
        "name": "Light",
        "url": "/api/2014/weapon-properties/light"
      },
      {
        "index": "thrown",
        "name": "Thrown",
        "url": "/api/2014/weapon-properties/thrown"
      },
      {
        "index": "monk",
        "name": "Monk",
        "url": "/api/2014/weapon-properties/monk"
      }
    ],
    "throw_range": {
      "normal": 20,
      "long": 60
    },
    "material": "metal",
    "url": "/api/2014/equipment/handaxe"
  },
  {
    "index": "javelin",
    "name": "Javelin",
    "equipment_category": {
      "index": "weapon",
      "name": "Weapon",
      "url": "/api/2014/equipment-categories/weapon"
    },
    "weapon_category": "Simple",
    "weapon_range": "Melee",
    "category_range": "Simple Melee",
    "cost": {
      "quantity": 5,
      "unit": "sp"
    },
    "damage": {
      "damage_dice": "1d6",
      "damage_type": {
        "index": "piercing",
        "name": "Piercing",
        "url": "/api/2014/damage-types/piercing"
      }
    },
    "range": {
      "normal": 5
    },
    "weight": 2,
    "properties": [
      {
        "index": "thrown",
        "name": "Thrown",
        "url": "/api/2014/weapon-properties/thrown"
      },
      {
        "index": "monk",
        "name": "Monk",
        "url": "/api/2014/weapon-properties/monk"
      }
    ],
    "throw_range": {
      "normal": 30,
      "long": 120
    },
    "material": "metal",
    "stackable": true,
    "url": "/api/2014/equipment/javelin"
  },
  {
    "index": "light-hammer",
    "name": "Light hammer",
    "equipment_category": {
      "index": "weapon",
      "name": "Weapon",
      "url": "/api/2014/equipment-categories/weapon"
    },
    "weapon_category": "Simple",
    "weapon_range": "Melee",
    "category_range": "Simple Melee",
    "cost": {
      "quantity": 2,
      "unit": "gp"
    },
    "damage": {
      "damage_dice": "1d4",
      "damage_type": {
        "index": "bludgeoning",
        "name": "Bludgeoning",
        "url": "/api/2014/damage-types/bludgeoning"
      }
    },
    "range": {
      "normal": 5
    },
    "weight": 2,
    "properties": [
      {
        "index": "light",
        "name": "Light",
        "url": "/api/2014/weapon-properties/light"
      },
      {
        "index": "thrown",
        "name": "Thrown",
        "url": "/api/2014/weapon-properties/thrown"
      },
      {
        "index": "monk",
        "name": "Monk",
        "url": "/api/2014/weapon-properties/monk"
      }
    ],
    "throw_range": {
      "normal": 20,
      "long": 60
    },
    "material": "metal",
    "url": "/api/2014/equipment/light-hammer"
  },
  {
    "index": "mace",
    "name": "Mace",
    "equipment_category": {
      "index": "weapon",
      "name": "Weapon",
      "url": "/api/2014/equipment-categories/weapon"
    },
    "weapon_category": "Simple",
    "weapon_range": "Melee",
    "category_range": "Simple Melee",
    "cost": {
      "quantity": 5,
      "unit": "gp"
    },
    "damage": {
      "damage_dice": "1d6",
      "damage_type": {
        "index": "bludgeoning",
        "name": "Bludgeoning",
        "url": "/api/2014/damage-types/bludgeoning"
      }
    },
    "range": {
      "normal": 5
    },
    "weight": 4,
    "properties": [
      {
        "index": "monk",
        "name": "Monk",
        "url": "/api/2014/weapon-properties/monk"
      }
    ],
    "material": "metal",
    "url": "/api/2014/equipment/mace"
  },
  {
    "index": "quarterstaff",
    "name": "Quarterstaff",
    "equipment_category": {
      "index": "weapon",
      "name": "Weapon",
      "url": "/api/2014/equipment-categories/weapon"
    },
    "weapon_category": "Simple",
    "weapon_range": "Melee",
    "category_range": "Simple Melee",
    "cost": {
      "quantity": 2,
      "unit": "sp"
    },
    "damage": {
      "damage_dice": "1d6",
      "damage_type": {
        "index": "bludgeoning",
        "name": "Bludgeoning",
        "url": "/api/2014/damage-types/bludgeoning"
      }
    },
    "range": {
      "normal": 5
    },
    "weight": 4,
    "properties": [
      {
        "index": "versatile",
        "name": "Versatile",
        "url": "/api/2014/weapon-properties/versatile"
      },
      {
        "index": "monk",
        "name": "Monk",
        "url": "/api/2014/weapon-properties/monk"
      }
    ],
    "two_handed_damage": {
      "damage_dice": "1d8",
      "damage_type": {
        "index": "bludgeoning",
        "name": "Bludgeoning",
        "url": "/api/2014/damage-types/bludgeoning"
      }
    },
    "material": "wood",
    "url": "/api/2014/equipment/quarterstaff"
  },
  {
    "index": "sickle",
    "name": "Sickle",
    "equipment_category": {
      "index": "weapon",
      "name": "Weapon",
      "url": "/api/2014/equipment-categories/weapon"
    },
    "weapon_category": "Simple",
    "weapon_range": "Melee",
    "category_range": "Simple Melee",
    "cost": {
      "quantity": 1,
      "unit": "gp"
    },
    "damage": {
      "damage_dice": "1d4",
      "damage_type": {
        "index": "slashing",
        "name": "Slashing",
        "url": "/api/2014/damage-types/slashing"
      }
    },
    "range": {
      "normal": 5
    },
    "weight": 2,
    "properties": [
      {
        "index": "light",
        "name": "Light",
        "url": "/api/2014/weapon-properties/light"
      },
      {
        "index": "monk",
        "name": "Monk",
        "url": "/api/2014/weapon-properties/monk"
      }
    ],
    "material": "metal",
    "url": "/api/2014/equipment/sickle"
  },
  {
    "index": "spear",
    "name": "Spear",
    "equipment_category": {
      "index": "weapon",
      "name": "Weapon",
      "url": "/api/2014/equipment-categories/weapon"
    },
    "weapon_category": "Simple",
    "weapon_range": "Melee",
    "category_range": "Simple Melee",
    "cost": {
      "quantity": 1,
      "unit": "gp"
    },
    "damage": {
      "damage_dice": "1d6",
      "damage_type": {
        "index": "piercing",
        "name": "Piercing",
        "url": "/api/2014/damage-types/piercing"
      }
    },
    "range": {
      "normal": 5
    },
    "weight": 3,
    "properties": [
      {
        "index": "thrown",
        "name": "Thrown",
        "url": "/api/2014/weapon-properties/thrown"
      },
      {
        "index": "versatile",
        "name": "Versatile",